<?xml version="1.0" encoding="UTF-8"?>
<!ELEMENT plantilla (trabajador)*>
<!ELEMENT trabajador (nombre,sueldo,posicion)>
<!ELEMENT nombre (#PCDATA)>
<!ELEMENT sueldo (#PCDATA)>
<!ELEMENT posicion (#PCDATA)>

<!ATTLIST trabajador
          idEmpleado ID #REQUIRED
          idJefe IDREF #IMPLIED>